thread_ID, Id, ParentId, PostType, Score, CreationDate, OwnerID, Body
30021957,30021957,null,1,4,Mon May 04 02:56:00 EDT 2015,3352481,"<p>I got the <strong>WinIoT</strong> booted up and can communicate with it using <strong>PowerShell</strong>, but connecting a keyboard/mouse to the USB ports just doesn't work.</p>		<p>Is there a trick I don't know? The FAQ lists USB keyboard / mouse as supported devices, so I suspect it's me.</p>	"
30021957,55960205,30021957,3,0,Sat Dec 05 11:44:00 EST 2015,87912,"I'm using a Logitech K120 and it keeps repeating keypresses and missing others. Very frustrating. This is the sort of thing I would have thought Windows would have nailed."
30021957,48176559,30021957,3,0,Mon May 04 12:30:00 EDT 2015,1095741,"I'm up and running with keyboard and mouse (Corsair K60/Logitech G500). I've tried a couple of things that didn't work - Keysonic 540RF, Wacom Bamboo Touch. Could be device-specific niggles perhaps?"
30021957,48220952,30021957,3,0,Tue May 05 12:41:00 EDT 2015,3352481,"Okay, I'll swap out a few different models/brands to see if I can find something that works.  Thanks!"
30021957,48221096,30021957,3,0,Tue May 05 12:44:00 EDT 2015,1095741,"The KeySonic decided to fire up the other day, so it's only the Bamboo that's failing. I found the IoT Browser sample project helpful for testing inputs."
30021957,33366612,30021957,2,0,Tue Oct 27 11:19:00 EDT 2015,1726296,"<p>There are problems related to Keyboard and Mouse. Not all keyboard and mouse are supported. Either they don't work or behave strangely.	Following are the make working in my setup:</p>		<ol>	<li>Keyboard : DELL USB Business Keyboard KB212</li>	<li>Mouse: Microsoft Optical mouse Model 1113</li>	<li>Wifi Adaptor: Raspberry Pi Wifi Adapter (Claimed to be only wifi adapter works with Raspberry Pi)</li>	<li>Bluetooth Dongle: Bluetooth CSR 4.0 A10 dongle </li>	</ol>		<p>Windows and Raspberry Pi... Long way to go.</p>	"
