thread_ID, Id, ParentId, PostType, Score, CreationDate, OwnerID, Body
31807685,31807685,null,1,-3,Tue Aug 04 11:09:00 EDT 2015,4033049,"<p>2015-08-04T08:03:04.54-0300 [STG/0]      OUT        └── when@3.7.3	2015-08-04T08:03:04.57-0300 [STG/0]      OUT        WARNING: No Procfile, package.json start script, or server.js file found	2015-08-04T08:03:04.57-0300 [STG/0]      OUT        WARNING: App Management cannot be installed because the start script cannot be found.	2015-08-04T08:03:04.60-0300 [STG/0]      ERR 	2015-08-04T08:03:31.22-0300 [STG/150]    OUT -----> Uploading droplet (73M)	2015-08-04T08:04:07.37-0300 [DEA/150]    OUT Starting app instance (index 0) with guid 8d0b7921-2896-4ea9-b0dc-a3b6f6646861</p>	"
31807685,51563018,31807685,3,0,Tue Aug 04 20:44:00 EDT 2015,2117239,"Also, there are no actual error messages there - they are warnings, but nothing here indicates the app hasn't (eventually) started."
31807685,51541244,31807685,3,0,Tue Aug 04 11:18:00 EDT 2015,504554,"You're going to have to give a lot more detail and context for anybody to be able to help"
31807685,51541283,31807685,3,0,Tue Aug 04 11:19:00 EDT 2015,504554,"Also possible duplicate of http://stackoverflow.com/questions/31784536/your-application-is-staging-to-create-bluemix-node-red-app"
31807685,31819337,31807685,2,0,Tue Aug 04 21:06:00 EDT 2015,4454969,"<p>It appears you are trying to use the Bluemix boilerplate to create an IoT Foundation starter as per these instructions:  <a href="https://www.ng.bluemix.net/docs/starters/IoT/iot500.html" rel="nofollow">https://www.ng.bluemix.net/docs/starters/IoT/iot500.html</a>  Is that right?  </p>		<p>I just tested myself and see similar errors, but the application did eventually start as @knolleary suggested.  </p>		<p>I will check with the team that supports that boilerplate to determine why those errors are being thrown, but it appears you can continue with  the application testing as it should start to run and be editable in your Node-RED GUI. </p>	"
