thread_ID, Id, ParentId, PostType, Score, CreationDate, OwnerID, Body
32038541,32038541,null,1,0,Sun Aug 16 18:33:00 EDT 2015,5232943,"<p>I am a newbie to Bluemix and Node Red (even stackoverflow). I have tried to create an app in Bluemix using the Node Red and IOT Foundation starter, but neither creates the app. The error message is:</p>		<pre><code>BXNUI2028E: Cloud Foundry issued an unexpected exception with the following	message: "Read timed out" See the Troubleshooting topics in the IBM Bluemix	Documentation to check service status, review troubleshooting information,	or for information about getting help.	</code></pre>		<p>I searched stackoverflow and this problem is mentioned, but is reported as fixed a few days ago. Help is appreciated.</p>	"
32038541,52051446,32038541,3,0,Tue Aug 18 16:13:00 EDT 2015,4714089,"What region are you using? Does this happen each time you try to create an app?"
32038541,51987890,32038541,3,0,Mon Aug 17 06:28:00 EDT 2015,4923755,"Some more details, please. BTW: The status for all Bluemix services can be seen here https://developer.ibm.com/bluemix/support/#status. Sometimes there is scheduled maintenance."
32038541,53071484,32038541,3,1,Wed Sep 16 13:41:00 EDT 2015,4454969,"Are you still having this issue or is it resolved?"
32038541,32092663,32038541,2,2,Wed Aug 19 10:15:00 EDT 2015,4823535,"<p>not sure if your case could be similar to this one</p>		<p><a href="https://developer.ibm.com/answers/questions/164719/bxnui2028e-cloud-foundry-issued-an-unprocessed-exc.html" rel="nofollow">https://developer.ibm.com/answers/questions/164719/bxnui2028e-cloud-foundry-issued-an-unprocessed-exc.html</a></p>		<p>if not I would suggest to open a ticket to Bluemix Support(see the Support tab inside the Bluemix Console) attaching the log as indicated here:</p>		<p><a href="https://www.ng.bluemix.net/docs/troubleshoot/getting_customer_support.html#collect_diag" rel="nofollow">https://www.ng.bluemix.net/docs/troubleshoot/getting_customer_support.html#collect_diag</a></p>		<p>I hope this helps.</p>	"
