thread_ID, Id, ParentId, PostType, Score, CreationDate, OwnerID, Body
34807135,34807135,null,1,2,Fri Jan 15 08:40:00 EST 2016,4726165,"<p>I am trying to start my node-red on a raspberry pi 2 using pm2. I am using the startup command:</p>		<pre><code>pm2 start /usr/bin/node-red-pi --node-args="--max-old-space-size=128" -- -v	</code></pre>		<p>At first it seems to work:</p>		<p><a href="https://i.stack.imgur.com/1AOPh.png" rel="nofollow noreferrer"><img src="https://i.stack.imgur.com/1AOPh.png" alt="NodeRed Startup pm2"></a></p>		<p>But unfortunatly then it errors:</p>		<p><a href="https://i.stack.imgur.com/N97ym.png" rel="nofollow noreferrer"><img src="https://i.stack.imgur.com/N97ym.png" alt="NodeRed Error pm2"></a></p>		<p>Thats the log:</p>		<pre><code>SyntaxError: Unexpected token ILLEGAL	at exports.runInThisContext (vm.js:53:16)	at Module._compile (module.js:373:25)	at Object.Module._extensions..js (module.js:404:10)	at Module.load (module.js:343:32)	at Function.Module._load (module.js:300:12)	at Function._load (/usr/local/lib/node_modules/pm2/node_modules/pmx/lib/transaction.js:62:21)	at Object.&lt;anonymous&gt; (/usr/local/lib/node_modules/pm2/lib/ProcessContainerFork.js:28:21)	at Module._compile (module.js:397:26)	at Object.Module._extensions..js (module.js:404:10)	at Module.load (module.js:343:32)	</code></pre>	"
34807135,59622463,34807135,3,0,Mon Mar 14 10:21:00 EDT 2016,4054214,"Did you solve the problem?"
34807135,60394482,34807135,3,0,Sun Apr 03 17:48:00 EDT 2016,1626033,"I'm also having this issue. Were you able to fix it?"
34807135,60395272,34807135,3,0,Sun Apr 03 18:25:00 EDT 2016,4726165,"hi - not with "node-red-pi". what I did was to reset overclocking on my pi - no overclocking anymore and I startet node-red with the normal "node-red" command in pm2. the pi is running now for 2 months without any problems. have to say that only node-red is running on this machine so I don't care about the RAM usage...."
34807135,62387789,34807135,3,0,Wed May 25 16:18:00 EDT 2016,3650545,"Same problem in windows x64 with node-red, pm2 tries to start and after about 15 successful reattmpts cannot do it so gives up."
34807135,40548613,34807135,2,0,Fri Nov 11 13:02:00 EST 2016,526390,"<p>Please make sure you installed the latest PM2 version (>2.x):</p>		<pre><code>$ npm install pm2@latest -g	$ pm2 update	</code></pre>		<p>Then start node-red again, it should works as expected:</p>		<pre><code>pm2 start node-red --node-args="--max-old-space-size=128" -- -v 	</code></pre>	"
