thread_ID, Id, ParentId, PostType, Score, CreationDate, OwnerID, Body
35435960,35435960,null,1,-1,Tue Feb 16 15:05:00 EST 2016,5933675,"<p>I am building UWP application sending HTTP(s) requests to remote server and I have problem adding HTTP headers "Content-Type". I have tried to use method HttpRequestMessage.Headers.Add, ended with exception. Then HttpClient.DefaultRequestHeaders.TryAddWithoutValidation, not doing anything. Any idea/hint what to do, please?</p>	"
35435960,58570497,35435960,3,0,Tue Feb 16 15:18:00 EST 2016,793891,"Please edit your question to add your code"
35435960,35437251,35435960,2,0,Tue Feb 16 16:01:00 EST 2016,5911793,"<p>If I understand the question correctly,</p>		<pre><code>httpClient.DefaultRequestHeaders.Accept.Add(new MediaTypeWithQualityHeaderValue("&lt;type&gt;"));	</code></pre>		<p>ought to do the trick for you.</p>	"
35435960,35506138,35435960,2,0,Fri Feb 19 13:09:00 EST 2016,4558911,"<p>The content type header is added when you set the content of your request. You cannot alter the header directly.</p>		<p>You should have a look at the HttpXXXContent classes of the <a href="https://msdn.microsoft.com/en-us/library/windows/apps/windows.web.http.aspx" rel="nofollow">Windows.Web.Http</a> namespace.</p>		<p>For example, if you are sending your content as string, you can use the <a href="https://msdn.microsoft.com/en-us/library/windows/apps/dn279669.aspx" rel="nofollow">HttpStringContent</a> as:</p>		<pre><code>var content = new HttpStringContent("my content string", Windows.Storage.Streams.UnicodeEncoding.Utf8, "text/xml");	var response = await m_client.PostAsync(m_serverUri, content;	</code></pre>		<p>You can also use <a href="https://msdn.microsoft.com/en-us/library/windows/apps/windows.web.http.httpformurlencodedcontent.aspx" rel="nofollow">HttpFormUrlEncodedContent</a>, <a href="https://msdn.microsoft.com/en-us/library/windows/apps/windows.web.http.httpbuffercontent.aspx" rel="nofollow">HttpBufferContent</a>...</p>	"
35435960,35513609,35435960,2,0,Fri Feb 19 19:40:00 EST 2016,85113,"<p>I'm using this code:</p>		<pre><code>using (var hc = new HttpClient()) {	    var content = new StringContent(..., Encoding.UTF8, "application/json");	    using (var response = await hc.PostAsync(..., content)) {	        ...	    }	}	</code></pre>		<p>Or this one:</p>		<pre><code>using (var hc = new HttpClient()) {	    var content = new MultipartFormDataContent();	    content.Add(new FileContent(..., "text/xml", ...));	    using (var response = await hc.PostAsync(..., content)) {	        ...	    }	}	</code></pre>	"
