thread_ID, Id, ParentId, PostType, Score, CreationDate, OwnerID, Body
36324300,36324300,null,1,22,Thu Mar 31 04:40:00 EDT 2016,2414957,"<p>I am following <a href="https://ms-iot.github.io/content/en-US/win10/samples/KitBlinky.htm" rel="noreferrer">this tutorial</a> and get the following error:</p>		<pre><code>Severity Code Description Project File Line Suppression State	Error DEP0100 : Please ensure that target device has developer mode enabled. Could not obtain a developer license due to error 800704C7.	</code></pre>		<p>I am not sure how to do so in the <code>Raspberry Pi 3</code> (which I have fed its public <code>IP</code> in front of <code>Target Machine</code> in the <code>Debug</code> tab of <code>Properties</code> in the <code>solution explorer</code>.  I am debugging on the remote machine selecting <code>ARM</code> as the screenshot below shows. Any information is appreciated specially if you have experience with Windows 10 IoT core. </p>		<p>My laptop is running Windows 10 enterprise and I am using Visual Studio 2015 community edition. I am planning to run the Blinky example provided by MS IoT team remotely on the Raspberry Pi that already is running <code>Windows 10</code> insider edition.	<a href="https://i.stack.imgur.com/a4d4P.png" rel="noreferrer"><img src="https://i.stack.imgur.com/a4d4P.png" alt="enter image description here"></a></p>	"
36324300,61480206,36324300,3,0,Sun May 01 00:10:00 EDT 2016,3111338,"When working with "Universal Apps" in Visual Studio, the XAML designer won't work if "Developer Mode" isn't enabled. So make sure your windows developer mode is enabled."
36324300,66868842,36324300,3,0,Fri Sep 30 09:09:00 EDT 2016,1786596,"not sure why this downvoted. just solved my problem"
36324300,36324542,36324300,2,41,Thu Mar 31 05:02:00 EDT 2016,2414957,"<p>Solved the problem by going to the "For developers" settings dialog (you can search for it with this string in the "Start" button), and selecting the <code>developer mode</code> like the following screenshot.</p>		<p><a href="https://i.stack.imgur.com/crXrU.png" rel="noreferrer"><img src="https://i.stack.imgur.com/crXrU.png" alt="enter image description here"></a></p>	"
36324300,78013499,36324542,3,2,Sat Aug 05 21:40:00 EDT 2017,2240706,"What a useless error message; suggests the issue is with the IoT device, rather than indicating the problem is not having developer mode enabled locally...  Will file this as an issue against Visual Studio"
36324300,78353248,36324542,3,0,Tue Aug 15 16:41:00 EDT 2017,2441511,"If you've somehow lost that window:  "You can go to the For developers page at any time to enable or disable Developer Mode: simply enter "for developers" into the Cortana search box in the taskbar." [reference: Micosoft Docs](https://docs.microsoft.com/en-us/windows/uwp/get-started/enable-your-device-for-development)"
36324300,62406766,36324542,3,3,Thu May 26 06:22:00 EDT 2016,null,"This is the correct solution."
