thread_ID, Id, ParentId, PostType, Score, CreationDate, OwnerID, Body
37926382,37926382,null,1,1,Mon Jun 20 15:32:00 EDT 2016,6489903,"<p>I send data to the IoT Hub and receive it, it works, but i dont know how i can work with the received Data: here is my Code to receive data:</p>		<pre><code>public void accept(PartitionReceiver receiver)	            {	                System.out.println("** Created receiver on partition " + partitionId);	                try {	                    while (true) {	                        Iterable&lt;EventData&gt; receivedEvents = receiver.receive(10).get();	                        int batchSize = 0;	                        if (receivedEvents != null)	                        {	                            for(EventData receivedEvent: receivedEvents)	                            {                                    	                                System.out.println(String.format("| Time: %s", receivedEvent.getSystemProperties().getEnqueuedTime()));	                                System.out.println(String.format("| Device ID: %s", receivedEvent.getProperties().get("iothub-connection-device-id")));	                                System.out.println(String.format("| Message Payload: %s", new String(receivedEvent.getBody(), Charset.defaultCharset())));	                                batchSize++;	                            }	                        }	                    }	                }	                catch (Exception e)	                {	                    System.out.println("Failed to receive messages: " + e.getMessage());	                }	            }	</code></pre>		<p>I would like to work with the received data, here I become the data as JSON String:</p>		<pre><code>System.out.println(String.format("| Message Payload: %s", new String(receivedEvent.getBody(), Charset.defaultCharset())));	</code></pre>		<p>The dataoutput is: product: xy, price: 2.3.	I would like take the data to :</p>		<pre><code>String product= product;	double price= price;	</code></pre>		<p>How can I the received Payload save in the variable?</p>		<p>Thanks</p>	"
37926382,63338693,37926382,3,0,Tue Jun 21 12:59:00 EDT 2016,50911,"Can you provide more information about how you're trying to receive the data? You may find this article useful which describes both sending and receiving data to IoT Hub using the Java SDK: https://azure.microsoft.com/documentation/articles/iot-hub-java-java-getstarted/"
37926382,63415233,37926382,3,0,Thu Jun 23 07:45:00 EDT 2016,6489903,"It works! thanks @ Peter Pan and Domic Betts"
37926382,37956853,37926382,2,2,Wed Jun 22 00:50:00 EDT 2016,4989676,"<p>There are two kinds of messages which include <code>device-to-cloud</code> and <code>cloud-to-device</code>.</p>		<p>For the first kind, <code>device-to-cloud</code> messages, as @DominicBetts said, you can refer to the section <a href="https://azure.microsoft.com/en-us/documentation/articles/iot-hub-java-java-getstarted/#receive-device-to-cloud-messages" rel="nofollow"><code>Receive device-to-cloud messages</code></a> to know how to receive d2c messages with Event Hub-compatible endpoint. And there are two samples as references on GitHub, please see below.</p>		<ol>	<li><a href="https://github.com/Azure/azure-iot-sdks/blob/master/java/device/samples/send-receive-sample" rel="nofollow">Simple send/receive sample</a>: Shows how to connect then send and receive messages to and from IoT Hub, passing the protocol of your choices as a parameter.</li>	<li><a href="https://github.com/Azure/azure-iot-sdks/blob/master/java/device/samples/handle-messages" rel="nofollow">Simple sample handling messages received</a>: : Shows how to connect to IoT Hub and manage messages received from IoT Hub, passing the protocol of your choices as a parameter.</li>	</ol>		<p>For the second kind, <code>cloud-to-device</code> messages, you can refer to the section <a href="https://azure.microsoft.com/en-us/documentation/articles/iot-hub-csharp-csharp-c2d/#receiving-messages-on-the-simulated-device" rel="nofollow"><code>Receiving messages on the simulated device</code></a> to know how to receive c2d messages. The sample code in the article was writen for C#, but I think it's simple for using Java instead of C#, please notice the note in the section for choosing the suitable protocol.</p>	"
37926382,63468223,37956853,3,0,Fri Jun 24 12:02:00 EDT 2016,6489903,"Have you any idea?"
37926382,63538179,37956853,3,0,Mon Jun 27 08:47:00 EDT 2016,4989676,"@ofitz Please see http://stackoverflow.com/questions/38028130/how-can-i-work-with-the-received-data-from-azure-iot-hub."
