thread_ID, Id, ParentId, PostType, Score, CreationDate, OwnerID, Body
40062302,40062302,null,1,0,Sat Oct 15 17:47:00 EDT 2016,1217998,"<p>The sample comes with temperature and humidity as data fields. Although I replaced the data with my own different fields, the names remain the same. </p>		<p>I cannot find a simple rename column option. How do I change it?</p>	"
40062302,67428240,40062302,3,0,Mon Oct 17 02:21:00 EDT 2016,6601582,"Which sample? Where are the data fields located? Would you mind providing more detailed information?"
40062302,67460127,40062302,3,0,Mon Oct 17 18:57:00 EDT 2016,1217998,"Remote monitoring sample. The fields are located in the devices and rules tab."
40062302,40100928,40062302,2,1,Tue Oct 18 06:21:00 EDT 2016,6601582,"<p>You can follow these steps:</p>		<ol>	<li>In the code, you need change the name in <code>DeviceRuleDataFields</code> class, for example, I changed "Humidity" to "HumidityEdit", look at this picture:	<a href="https://i.stack.imgur.com/rI0Q9.png" rel="nofollow"><img src="https://i.stack.imgur.com/rI0Q9.png" alt="enter image description here"></a></li>	<li>In IoT Device Portal Web page, you need select the rule you want to change, and you will see "Rule Properties" and "Edit" button in the right region, like this:	<a href="https://i.stack.imgur.com/HSKrB.png" rel="nofollow"><img src="https://i.stack.imgur.com/HSKrB.png" alt="enter image description here"></a></li>	<li>Press the "Edit" button and you enter the rule edit page, in the "DATA FIELD" select the "HumidityEdit", like this:	<a href="https://i.stack.imgur.com/yPEC4.png" rel="nofollow"><img src="https://i.stack.imgur.com/yPEC4.png" alt="enter image description here"></a></li>	<li>Save the change of the rule and you will get the changed data field name of the rule, look at this picture:	<a href="https://i.stack.imgur.com/FUP74.png" rel="nofollow"><img src="https://i.stack.imgur.com/FUP74.png" alt="enter image description here"></a></li>	</ol>	"
40062302,67537406,40100928,3,0,Wed Oct 19 14:09:00 EDT 2016,1217998,"I am using the nodejs API instead of C#. I am sure I have already tried the nodejs equivalent of what you just said. I am no longer planning to use Azure IOT but I will accept the answer for the reference of others."
