thread_ID, Id, ParentId, PostType, Score, CreationDate, OwnerID, Body
42835324,42835324,null,1,0,Thu Mar 16 13:21:00 EDT 2017,7511978,"<p>I am facing problem while adding blockchain extension to IoT service.That extension is not opend at all. Anyone can help me to resolve this problem.</p>	"
42835324,42836130,42835324,2,0,Thu Mar 16 13:56:00 EDT 2017,4454969,"<p>Blockchain is not enabled by default, it requires authorization.  You need to fill in the Kick-start your blockchain project form and then the blockchain team will get in touch: <a href="https://console.ng.bluemix.net/docs/services/IoT/reference/extensions/index.html#blockchain" rel="nofollow noreferrer">https://console.ng.bluemix.net/docs/services/IoT/reference/extensions/index.html#blockchain</a></p>	"
42835324,72781429,42836130,3,0,Thu Mar 16 13:58:00 EDT 2017,7511978,"Already that form is filled, but I didn't get any response"
42835324,72781492,42836130,3,0,Thu Mar 16 14:00:00 EDT 2017,4454969,"I will check with blockchain team about status."
42835324,72782376,42836130,3,0,Thu Mar 16 14:19:00 EDT 2017,7511978,"Thank you. If I get more help regarding that issue it's more thankful."
42835324,72783713,42836130,3,0,Thu Mar 16 14:47:00 EDT 2017,7511978,"May I know the status of blockchain team."
42835324,73004159,42836130,3,0,Wed Mar 22 14:37:00 EDT 2017,7511978,"I submitted the form with karikatla@miraclesoft.com"
42835324,73085646,42836130,3,0,Fri Mar 24 11:10:00 EDT 2017,7511978,"I didn't get any response from those people till now."
42835324,72786474,42836130,3,0,Thu Mar 16 15:44:00 EDT 2017,4454969,"they did not find a form with your name.  Was it submitted under another name or is there  a company to reference?"
42835324,72999460,42836130,3,0,Wed Mar 22 12:56:00 EDT 2017,7511978,"Till now I am unable to access that service in IoT service. Can you help me to resolve this issue. Is there any other way to connect blockchain extension to IoT service"
42835324,72792799,42836130,3,0,Thu Mar 16 18:17:00 EDT 2017,4454969,"thanks for the info - will check with the team to see what they have for that email and account."
42835324,72786626,42836130,3,0,Thu Mar 16 15:47:00 EDT 2017,7511978,"it is submitted with vanitha3665@gmail.com this name."
42835324,72786727,42836130,3,0,Thu Mar 16 15:49:00 EDT 2017,7511978,"this is the account Miracle Software Systems"
42835324,73003788,42836130,3,0,Wed Mar 22 14:29:00 EDT 2017,4454969,"I had tried the gmail account you previously provided but did not receive a reply.  Is that your account/"
42835324,73004078,42836130,3,0,Wed Mar 22 14:35:00 EDT 2017,7511978,"I tried with the different account also.Is the only way to contact them to get the access to use that service."
42835324,43830119,42835324,2,0,Sun May 07 09:56:00 EDT 2017,7974588,"<p>Enter the following API request to your browser and it will activate your extension: https://.internetofthings.ibmcloud.com/api/v0002/blockchain/activate?code=1</p>	"
