thread_ID, Id, ParentId, PostType, Score, CreationDate, OwnerID, Body
43178450,43178450,null,1,1,Mon Apr 03 07:04:00 EDT 2017,5209770,"<p>I am trying to get the list of devices from azure IOT by using JAVA REST API.	when I use this URL </p>		<pre><code>https:iothubhostname/devices/?maxCount=5&amp;api-version=2015-07-01	</code></pre>		<p>It's giving response as:</p>		<blockquote>	  <p>ErrorCode:IotHubUnauthorizedAccess;Unauthorized</p>	</blockquote>		<p>Can you anyone help us, how to make this request as authorized request?</p>	"
43178450,73430021,43178450,3,0,Mon Apr 03 07:06:00 EDT 2017,6266254,"Notice that your URL is incorrect. You need to have `https://` - `https://iothubhostname/devices/?maxCount=5&api-version=2015-07-01`"
43178450,73430206,43178450,3,0,Mon Apr 03 07:12:00 EDT 2017,5209770,"Thank you Bubble Hacker. But url is not the problem.I tried with this url also (https://iothubhostname/devices/?maxCount=5&api-version=2015-07-01) . Its giving same error msg"
43178450,96391739,43178450,3,0,Thu Feb 21 12:59:00 EST 2019,5908629,"@Bhagya did you find any solution yet ?"
43178450,43200170,43178450,2,0,Tue Apr 04 06:49:00 EDT 2017,4938666,"<p>From the error message, we can know that there is something wrong with your authorization header. The following screenshot is my result:</p>		<p><a href="https://i.stack.imgur.com/CUkw0.png" rel="nofollow noreferrer"><img src="https://i.stack.imgur.com/CUkw0.png" alt="enter image description here"></a></p>		<p>Here is the http request details:</p>		<p><a href="https://i.stack.imgur.com/oLLHt.png" rel="nofollow noreferrer"><img src="https://i.stack.imgur.com/oLLHt.png" alt="enter image description here"></a></p>		<p>For how to generate Authorization header, please refer to <a href="https://docs.microsoft.com/en-us/azure/iot-hub/iot-hub-devguide-security" rel="nofollow noreferrer">this article</a>. Here is a key snippet from the article:</p>		<blockquote>	  <p>{signature}    An HMAC-SHA256 signature string of the form: {URL-encoded-resourceURI} + "\n" + expiry. Important: The key is decoded from base64 and used as key to perform the HMAC-SHA256 computation. </p>	</blockquote>		<p>Hope this could help your.</p>	"
43178450,81836651,43200170,3,0,Wed Nov 22 17:39:00 EST 2017,6998684,"What exactly could be wrong with authorization header?"
