thread_ID, Id, ParentId, PostType, Score, CreationDate, OwnerID, Body
47123472,47123472,null,1,-3,Sun Nov 05 15:46:00 EST 2017,8572631,"<p>I want to experiment with some sensors with my Raspberry Pi 3. For that, I searched for sensors to buy online. During the search some websites says "buy sensors for Arduino" and some says "buy sensors for Raspberry Pi". So. if I buy sensors for Arduino, will they work with Raspberry Pi or not?</p>	"
47123472,81203842,47123472,3,2,Sun Nov 05 21:32:00 EST 2017,794749,"I'm voting to close this question as off-topic because it's about hardware."
47123472,81203899,47123472,3,0,Sun Nov 05 21:35:00 EST 2017,4774918,""Do train wheels work on my VW Golf?""
47123472,47125874,47123472,2,0,Sun Nov 05 19:45:00 EST 2017,413127,"<p>'it depends" being the answer. </p>		<p>The short answer is: yes probably it will work on both. </p>		<p>The longer answer is you'll be doing some work arounds. (and each is case dependent). </p>		<hr>		<p>For example the <a href="https://www.arduino.cc/en/Tutorial/AnalogInputPins" rel="nofollow noreferrer">arduino has analog pins</a>, but AndroidThings boards do not - you would need to use a Analog to Digital converter (<a href="https://github.com/blundell/ads1015" rel="nofollow noreferrer">like this</a> <em>or any other ADC</em>).</p>		<hr>		<p>Android Things <a href="https://developer.android.com/things/sdk/pio/index.html" rel="nofollow noreferrer">supports these protocols &amp; interfaces</a>	- I2C	- SPI	- UART	- PWM	- I2S</p>		<p>If the peripheral uses one of these, then yes it will more than likely work an AndroidThings (a raspberry pi).</p>		<hr>		<p>AT also supports GPIO. However if the sensor only uses GPIO, it is likely to require a fast communication speed (in the range of 10's of nano seconds), but Android Things GPIO is slow (the frequency is in the range of 300± nano seconds) - so you'll probably find <em>these sensors</em> are not supported on AT (a raspberry pi). </p>		<hr>		<p>If after all that you buy a sensor and it won't work with Android Things - you can still use the sensor with an Arduino board and then control the Arduino Board with a Raspberry Pi as a master (<a href="http://nilhcem.com/android-things/arduino-as-an-i2c-slave" rel="nofollow noreferrer">like this</a>).</p>	"
47123472,81204207,47125874,3,2,Sun Nov 05 21:51:00 EST 2017,4774918,"SPI is not a protocol, nor are UART or PWM. I2C is just basic. None has higher layer functions. Said that: please refrain from answering off-topic questions. With 50k reps, you should help moderating the site and close-vote them instead."
47123472,81204401,47125874,3,1,Sun Nov 05 22:03:00 EST 2017,413127,""is just basic" is not a definition. Your idea of protocol is clearly different to mine. If I said "protocol/interface" would it please you? -1 for an answer that will clearly help the person is pretty pathetic just to try and "follow the rules".  Closing a legitimate question doesn't help anyone. If anything it should be migrated and if it was migrated the answer would go with it. Therefore I am happy I helped this person by answering the question."
47123472,81204623,47125874,3,3,Sun Nov 05 22:17:00 EST 2017,4774918,"You want to read [ask] to see which questions to answer and which to close. Also you should not assume someone leaving a comment is the same person who downvoted! And the question is clearly not legitimate **here**."
47123472,81205436,47125874,3,0,Sun Nov 05 23:13:00 EST 2017,494879,""clearly" is not the case. The reason for the close is "general hardware" of which arduinos and rPis are not. OP is clearly a programmer and this person seems to have written a helpful answer."
47123472,81226770,47125874,3,1,Mon Nov 06 14:05:00 EST 2017,8572631,"What's wrong with you guys? If someone wants to help, then let him help. Do not hang with how to ask instead concentrate on the mottos of this website."
