thread_ID, Id, ParentId, PostType, Score, CreationDate, OwnerID, Body
47697233,47697233,null,1,0,Thu Dec 07 14:26:00 EST 2017,5352886,"<p>I am inserting 80 record/sec to DocumentDB using C#. Everything works well but somehow my server CPU usage reach to 90% and it crashes application.</p>		<p>I have taken care of everything which includes, Singleton DocumentClient, Indexing, Throughput limit, Direct connection mode, TCP connection, retry policy, open connection safely before first request.</p>		<p>Any one have idea on this?</p>	"
47697233,82363161,47697233,3,0,Thu Dec 07 18:37:00 EST 2017,743,"Is it 90% of the server that you are calling CosmosDB from OR is it 90% of your OfferThroughput/RequestUnits as reported by the Azure portal?	Are you getting throttled by CosmosDB?"
47697233,82375250,47697233,3,0,Fri Dec 08 04:22:00 EST 2017,5352886,"@RalphWillgoss It is 90% of server. I have properly follow azure guidelines to take care of Throughput. No throttled by CosmosDB but application crash happens due to high CPU usage of server."
47697233,82375304,47697233,3,1,Fri Dec 08 04:25:00 EST 2017,4002490,"can you please share your source code?"
47697233,82375349,47697233,3,0,Fri Dec 08 04:29:00 EST 2017,5352886,"@AravindKrishnaR. It's just singleton DocumentClient object with Task.Run execution (with sample json). No extra code is written over there."
47697233,82419762,47697233,3,0,Sat Dec 09 14:37:00 EST 2017,743,"If you could post your code, then I can test against my own CosmosDB. Do you get the same result if you run the app locally and target the Emulator?"
47697233,47701215,47697233,2,-1,Thu Dec 07 18:08:00 EST 2017,8189867,"<p>Have you followed the performance tips listed here: <a href="http://azure.microsoft.com/blog/2015/01/20/performance-tips-for-azure-documentdb-part-1-2/" rel="nofollow noreferrer">http://azure.microsoft.com/blog/2015/01/20/performance-tips-for-azure-documentdb-part-1-2/</a> and <a href="http://azure.microsoft.com/blog/2015/01/27/performance-tips-for-azure-documentdb-part-2/" rel="nofollow noreferrer">http://azure.microsoft.com/blog/2015/01/27/performance-tips-for-azure-documentdb-part-2/</a>? You should see a performance of &lt; 10 ms on writes with DocumentDB aside from network latency of your connection.</p>		<p>Reference: <a href="https://stackoverflow.com/questions/41744582/fastest-way-to-insert-100-000-records-into-documentdb">Fastest way to insert 100,000+ records into DocumentDB</a></p>	"
47697233,82375275,47701215,3,0,Fri Dec 08 04:24:00 EST 2017,5352886,"Yes I have follow those guidelines, otherwise I want be able to dump 80 records / sec with 400 Throughput (5 throughput / record)."
