thread_ID, Id, ParentId, PostType, Score, CreationDate, OwnerID, Body
49492076,49492076,null,1,0,Mon Mar 26 12:58:00 EDT 2018,4761409,"<p>right now i'm using the following code:</p>		<pre><code>string patch = "{\"Device\": {\"DeviceState\": \"started\",\"Location\": {\"Latitude\": 50.400188,\"Longitude\": 30.61224}}}";	await _deviceClient.UpdateReportedPropertiesAsync(JsonConvert.DeserializeObject&lt;TwinCollection&gt;(patch));	</code></pre>		<p>This works fine, my requirement is i want to update the same (reported properties) using IOT hub rest API,  I read something like the following:</p>		<blockquote>	  <p>https://{{hubName}}.azure-devices.net/twins/{{deviceId}}?api-version=2016-11-14</p>	</blockquote>		<p>A patch request to the above api with a json payload, it is returning <strong>200Ok</strong>, but not updating the twin.</p>	"
49492076,85993335,49492076,3,0,Mon Mar 26 15:10:00 EDT 2018,8084828,"this is a service-facing endpoint, so it can be used only for changes on the tags and desired properties of the device twin. The device twin reported properties can be changed only from the device-facing endpoint."
49492076,86048900,49492076,3,2,Tue Mar 27 20:05:00 EDT 2018,8084828,"the device twin on the device-facing side is supported only for connection oriented protocols such as AMQP and MQTT in the present time. In other words, there is no REST API endpoint on the device-facing side for device twin properties."
49492076,86049035,49492076,3,0,Tue Mar 27 20:10:00 EDT 2018,8084828,"in the case of avoiding SDK library, I do recommend to use the MQTT protocol directly, see https://docs.microsoft.com/en-us/azure/iot-hub/iot-hub-mqtt-support#using-the-mqtt-protocol-directly"
49492076,86017968,49492076,3,0,Tue Mar 27 07:37:00 EDT 2018,4761409,"can you please tell me which end point i need to use, i'm not much familiar with this."
