thread_ID, Id, ParentId, PostType, Score, CreationDate, OwnerID, Body
50707784,50707784,null,1,1,Tue Jun 05 19:41:00 EDT 2018,9899653,"<p>I am currently setting up an MXChip (DevKit) for use with Azure by following the guide below:</p>		<p><a href="https://microsoft.github.io/azure-iot-developer-kit/docs/get-started/" rel="nofollow noreferrer">https://microsoft.github.io/azure-iot-developer-kit/docs/get-started/</a></p>		<p>After configuring the device connection string, I cannot complete the subsequent step (Build and upload Arduino sketch) without having to select a board type. These are the options listed:</p>		<ul>	<li>Arduino Yun</li>	<li>Arduino/Genuino Uno</li>	<li>Arduino Duemilanove</li>	<li>Arduino Nano</li>	<li>Arduino/Genuino Mega</li>	<li>Arduino Mega ADK</li>	<li>Arduino Leonardo</li>	<li>Arduino Leonardo ETH</li>	<li>Arduino/Genuino Micro</li>	<li>Arduino Esplora</li>	<li>Arduino Mini</li>	<li>Arduino Ethernet</li>	<li>Arduino Fio</li>	<li>Arduino BT</li>	<li>LilyPad Arduino USB</li>	<li>LilyPad Arduino</li>	<li>Arduino Pro</li>	<li>Arduino NG or Older</li>	<li>Arduino Robot Control</li>	<li>Arduino Robot Motor</li>	<li>Arduino Gemma</li>	<li>Adafruit Circuit Playground</li>	<li>Arduino Yun Mini</li>	<li>Arduino Industrial 101</li>	<li>Linino One</li>	<li>Arduino Uno WiFi</li>	</ul>		<p>I am unsure of which option to choose. Any help would be appreciated. Thanks. </p>	"
50707784,88425993,50707784,3,0,Tue Jun 05 20:30:00 EDT 2018,60761,"Are you sure you installed the "DevKit Board Package" ?"
50707784,88426095,50707784,3,0,Tue Jun 05 20:34:00 EDT 2018,9899653,"Yes, I successfully ran the install.cmd in the given zip file."
50707784,88426157,50707784,3,0,Tue Jun 05 20:36:00 EDT 2018,60761,"I don't have a setup here so I have no way of knowing if that's the same thing. Check it with the BoardManager."
50707784,88426339,50707784,3,0,Tue Jun 05 20:43:00 EDT 2018,9899653,"I checked board manager and while I did have an MXChip board package installed, I didn't have the most updated version. I installed that and it appeared as an option on the list. Thank you!"
50707784,88426454,50707784,3,0,Tue Jun 05 20:48:00 EDT 2018,60761,"Good. You can now post a self-answer for posterity. You could also leave a reaction on that ms page."
50707784,50708948,50707784,2,1,Tue Jun 05 21:07:00 EDT 2018,9899653,"<p>Type F1, and then enter Arduino: Board Manager into the action line to view board packages. Installing the newest edition of the MXChip Board Package will cause that package to appear as an option in the board type list.</p>		<p>I also ran into a subsequent compiling error in which the terminal indicated:</p>		<p><strong>"exec: "/bin/arm-none-eabi-g++": file does not exist"</strong></p>		<p>Installing the Arduino Zero Board Package from the board manager solved this error.   </p>	"
