thread_ID, Id, ParentId, PostType, Score, CreationDate, OwnerID, Body
51040229,51040229,null,1,0,Tue Jun 26 10:08:00 EDT 2018,8500089,"<p>I am new to this AWS IoT. I am having a problem with creating things. For this, I have gone through this document: </p>		<blockquote>	  <p><a href="https://docs.aws.amazon.com/iot/latest/apireference/API_CreateThing.html" rel="nofollow noreferrer">https://docs.aws.amazon.com/iot/latest/apireference/API_CreateThing.html</a></p>	</blockquote>		<p>I am having a problem with authorization. I am getting this error: </p>		<blockquote>	  <p>Failed to open TCP connection to xxxxxx.iot.us-east.amazonaws.com:443	  (getaddrinfo: Name or service not known)</p>	</blockquote>	"
51040229,89101359,51040229,3,0,Wed Jun 27 05:51:00 EDT 2018,4944773,"In the same document follow the authorization docs Here - https://docs.aws.amazon.com/iot/latest/developerguide/authorization.html"
51040229,89138075,51040229,3,0,Thu Jun 28 03:42:00 EDT 2018,8500089,"I am not being able to figure out how to authenticate"
51040229,89181214,51040229,3,0,Fri Jun 29 07:48:00 EDT 2018,6705994,"Are you trying to create thing using AWS_console?"
51040229,51097018,51040229,2,0,Fri Jun 29 08:00:00 EDT 2018,8500089,"<p>I have created thing on AWS IoT by:</p>		<pre><code>class AwsIotService		  def self.create_thing(thing_name)	    begin	      iot = Aws::IoT::Client.new(region: ENV['AWS_REGION'],	                             access_key_id: ENV['AWS_ACCESS_KEY_ID'],	                             secret_access_key: ENV['AWS_SECRET_ACCESS_KEY'])	      iot.create_thing(thing_name: thing_name)	    rescue Aws::IoT::Errors::ServiceError	    end	  end	end	</code></pre>	"
