thread_ID, Id, ParentId, PostType, Score, CreationDate, OwnerID, Body
51085966,51085966,null,1,0,Thu Jun 28 14:54:00 EDT 2018,8670853,"<p>On C#, raspberry, windows IOT, 	The app stop on this line </p>		<pre><code>StorageFile file = await storageFolder.GetFileAsync("Signature.jpg", 	    CreationCollisionOption.ReplaceExisting);	</code></pre>		<p>I get this error : </p>		<blockquote>	  <p>an item cannot be found at the specified path</p>	</blockquote>		<p>But Signature.jpg is on this folder existing</p>		<p>Thanks for your help,</p>	"
51085966,89243765,51085966,3,0,Mon Jul 02 05:22:00 EDT 2018,6601582,"@cretgil It seems an issue of Windows IoT Core. You can submit this via feedback hub."
51085966,89184423,51085966,3,0,Fri Jun 29 09:25:00 EDT 2018,6601582,"Hi cretgil, can the same app running on desktop access the file successfully?"
51085966,89160394,51085966,3,0,Thu Jun 28 14:57:00 EDT 2018,194717,"Check Signature.jpg `Build Action` https://stackoverflow.com/a/145769/194717"
51085966,89178046,51085966,3,0,Fri Jun 29 05:53:00 EDT 2018,8670853,"In this folder : StorageFolder storageFolder = await StorageFolder.GetFolderFromPathAsync(@"\\myserver\signatures");"
51085966,89189166,51085966,3,0,Fri Jun 29 11:46:00 EDT 2018,8670853,"yes on desktop the app access the file but not from a raspberry."
51085966,89175100,51085966,3,0,Fri Jun 29 02:29:00 EDT 2018,6601582,"Which folder the file exists?"
51085966,51130776,51085966,2,0,Mon Jul 02 07:09:00 EDT 2018,5752362,"<p>I can also reproduce this issue when access the shared file on a computer from Windows 10 IoT core.</p>		<p>The workaround for this issue is that you can setup a web server to share the file instead of using file sharing. For example, I setup the IIS on my computer and copy the signature.jpg to the root folder of IIS(C:\inetpub\wwwroot). Then we can use the code below download the file from IIS:</p>		<pre><code>    async void DownloadImageAndDisplay()	    {	        Uri fileUri = new Uri("http://{AddressOfPC}/signature.jpg");	        IRandomAccessStreamReference thumbnail =	RandomAccessStreamReference.CreateFromUri(fileUri);	       StorageFile imageFile=await StorageFile.CreateStreamedFileFromUriAsync("signature.jpg", fileUri, thumbnail);		        BitmapImage bitmapImage = new BitmapImage();	        Windows.Storage.Streams.RandomAccessStreamOverStream stream = (Windows.Storage.Streams.RandomAccessStreamOverStream)await imageFile.OpenAsync(FileAccessMode.Read);	        bitmapImage.SetSource(stream);	        image.Source = bitmapImage;	    }	</code></pre>	"
