thread_ID, Id, ParentId, PostType, Score, CreationDate, OwnerID, Body
51828304,51828304,null,1,0,Mon Aug 13 18:15:00 EDT 2018,10071975,"<p>I have the pubSub code example working, so I can publish to MQTT topics. And it is my understanding that I just need to change the topic to <code>"mything/shadow/update"</code>, and the shadow would be updated, but it doesn't.</p>		<p>My current shadow state looks like:</p>		<pre><code>{	  "desired":{	    "welcome": "aws-iot"	  },	  "reported":{	    "welcome": "aws-iot"	  }	}	</code></pre>	"
51828304,90621957,51828304,3,0,Tue Aug 14 05:11:00 EDT 2018,4944773,"Have you given appropriate permissions ?"
51828304,51834194,51828304,2,0,Tue Aug 14 05:21:00 EDT 2018,4944773,"<p>There can be multiple reasons why your shadow is not updating. Here might be some.</p>		<ol>	<li>In Cognito, there are no appropriate permissions for Update/Get Shadow both for authenticated and unauthenticated pool</li>	<li>The ARN of the Cognito Pool id as well as the IoT are incorrect</li>	<li>Check the IAM policy and the following policy to the Cognito users, Also for the Cognito user, you have to attach AttachPrincipalPolicy policy to give them appropriate permissions for Get/update the shadow. The policy below should be in the Cognito Auth and UnAuth roles.</li>	</ol>		<p>Policy : </p>		<pre><code>{	"Version": "2012-10-17",	"Statement": [	    {	        "Effect": "Allow",	        "Action": [	            "iot:AttachPrincipalPolicy"	        ],	        "Resource": [	            "*"	        ]	    }	] }	</code></pre>		<p>To suscribe to changes <code>$aws/things/thing_name/shadow/update/accepted</code></p>		<p>And to publish the data to the shadow <code>$aws/things/thing_name/shadow/update</code></p>		<p>Also do check if you are able to connect to the shadow.</p>	"
51828304,90677476,51834194,3,0,Wed Aug 15 16:24:00 EDT 2018,10071975,"Yes. When I publish and subscribe to shadow/update I can see the message, but when I subscribe to update/accepted, nothing shows up. So my question is why is it not being accepted. Also when I subscribe to update/rejected nothing shows up either."
51828304,90646019,51834194,3,0,Tue Aug 14 16:55:00 EDT 2018,10071975,"Thanks for your response. The changes in Cognito and IAM were uneffective. I am able to see the message on aws/things/thing_name/shadow/update, but not on update/accepted. Still unsure how to fix this."
51828304,90714357,51834194,3,0,Thu Aug 16 16:21:00 EDT 2018,10071975,"I'm not receiving anything though. And the shadow isn't changing. As I said pub/sub is working."
51828304,90689941,51834194,3,0,Thu Aug 16 03:20:00 EDT 2018,4944773,"Yes, update/accepted won’t show anything. We are just subscribing to the thing. It is the correct behaviour."
51828304,90691610,51834194,3,0,Thu Aug 16 05:23:00 EDT 2018,4944773,"You would just receive the entire shadow nothing else"
51828304,90666444,51834194,3,0,Wed Aug 15 10:35:00 EDT 2018,4944773,"is the shadow changing on shadow/update which is to publish? The update/accepted is to get the changed data(subscribe), not to publish"
