thread_ID, Id, ParentId, PostType, Score, CreationDate, OwnerID, Body
56089174,56089174,null,1,0,Sat May 11 09:57:00 EDT 2019,2615200,"<p>Now, I managed to successfully pull basic information from my smart device onto the terminal using pyHS100 on python (v3.6) using the following code </p>		<pre><code>from pyHS100 import SmartPlug	from pprint import pformat as pf	plug = SmartPlug("10.xxx.xxx.xxx")	print("Hardware: %s" % pf(plug.hw_info))	</code></pre>		<p>which results in the following:</p>		<p><a href="https://i.stack.imgur.com/oCkFj.jpg" rel="nofollow noreferrer"><img src="https://i.stack.imgur.com/oCkFj.jpg" alt="enter image description here"></a></p>		<p>but I can't parse the data into json format and display it on the local server for my RESTful API purpose if I done it this way:</p>		<pre><code>from flask import Flask, jsonify	from flask_restful import Resource, Api	from pyHS100 import SmartPlug		app = Flask(__name__)	@app.route('/api')	def get():	    plug = SmartPlug("10.xxx.xxx.xxx")	    sys = plug.hw_info	    return jsonify({'data':sys})		if __name__ == '__main__':	    app.run(host='0.0.0.0')	    app.run(debug=True)	</code></pre>		<p>All I need is for the information to be presented into something like this:</p>		<p><a href="https://i.stack.imgur.com/KcUeI.png" rel="nofollow noreferrer"><img src="https://i.stack.imgur.com/KcUeI.png" alt="enter image description here"></a></p>		<p><a href="https://i.stack.imgur.com/LZiE7.jpg" rel="nofollow noreferrer"><img src="https://i.stack.imgur.com/LZiE7.jpg" alt="enter image description here"></a>	What did I do wrong and how do I this fix? Thanks</p>	"
56089174,98817223,56089174,3,1,Sat May 11 12:27:00 EDT 2019,4799172,"That traceback doesn't reference your code at all. My best guess is that you have some mismatch between flask and werkzeug because it looks like it's separate from your app"
56089174,98815240,56089174,3,1,Sat May 11 09:59:00 EDT 2019,4799172,"Please fix your indentation and show the traceback"
56089174,98815931,56089174,3,0,Sat May 11 10:52:00 EDT 2019,2615200,"Got it. Please see the above"
56089174,56477904,56089174,2,0,Thu Jun 06 12:45:00 EDT 2019,2615200,"<p>I believe the best way to solving this is by using json.dumps</p>	"
